{
  "version": "2.0",
  "metadata": {
    "name": "sample-wave-off",
    "description": "Phase C sample — wave disabled by default (safe / no B2)"
  },
  "lineage": { "worldId": "sample-wave-off" },
  "geometry": {},
  "materials": {},
  "render": { "engineMode": "wavefront", "samples": 1, "maxDepth": 2 },
  "wave": {
    "enabled": false,
    "gridSize": { "nx": 16, "ny": 16, "nz": 16 },
    "c": 1.0,
    "dt": 0.016,
    "beta": 0.0,
    "gamma": 0.0,
    "waveDir": { "x": 0, "y": 1, "z": 0 }
  }
}
